{
  "$schema": "./schema.json",
  "name": "specialty-review",
  "description": "Single-stage workflow for specialty review child tasks; the dispatcher binds the specialty agent at creation",
  "visibility": "internal",
  "stages": [
    {
      "name": "review",
      "description": "Specialty reviewer inspects the dispatched branch and records a PASS/FAIL verdict, then parks until the dispatcher collects the verdict and closes the child",
      "prompt": "$TASK_PROMPT",
      "policy": { "transition": "manual" }
    }
  ]
}
